"nombre","titulo_comentario","contenido_comentario"
"Julia","Me cobraron el Pan!!","El servicio es de respuestas Si o No.
Te cobran el Pan.
La Berenjena a la parmegiana no me gusto, se nota que está montada al momento, cuando es una preparación que va horneada y el tomate ácido, falto de cocción.
El jugo de mandarina...Más"
"Archie's","Almuerzo","Comida nada especial, me cobraron 4.000 adicional por adición de crema de leche para la sopa de tortilla. Mesero despectivo y no me preguntaron si quería incluir el servicio, lo cual es ilegal."
"Cuzco","El mesero nos engañó","Fuimos 5 amigos, comimos, todo bien, pero el mesero pasaba desde las 10pm a decirnos que la cocina cerraba a las 11pm. Entonces a las 10:50 ordenamos el postre, y muy grosero nos respondió que no tenía postres calientes porque la cocina cerró a las...Más"
"Deluchi Pizza Por Metro","No compren groupones (por lo menos para ma sede de Bucaramanga)","Aviso comunitario. Ni se les ocurra comprar groupones para este negocio. No los canjean con la excusa de que el Administrador no se encuentra. Terrible. Falta de seriedad. 👎"
"Buffet King Bogota San Martin","Cantidad pero no calidad","La sazon no es muy buena...usualmente en otros paises los tenedores libres tienen una sazon espectacular, pero aqui les falta mejorar eso"
"Central Cevicheria av. 19","Muy costoso para tan poco","Estuvimos celebrando el día del padre, el sitio no estaba tan lleno aún así debimos esperar más de 1 hora para recibir nuestro pedido, el cual llegó y si bien estaba bueno, la porción era muy justa , para el precio final q pagamos, platos...Más"
"Ugly American Bar & Grill","Comida demasiado cara y de regular calidad","""El emperador va desnudo"", debería ser el lema de este restaurante, donde la comida es grasosa y de regular calidad, mientras debe llegar dispuesto a empeñar un riñón o una córnea para pagar la cuenta. En Bogotá hay muchos lugares de hamburguesas exquisitas, y este...Más"
"Casa","Decepcionante","El arroz de “langostinos” tenía algo más pequeño que un camarón. Los precios altísimos por una calidad irrespetuosa. Para no volver."
"Masa Panaderia, Cafe","Mucho tiempo de espera. Excelente comida","Entre 60 min a 80 min de tiempo de espera en la fila los fines de semana en la mañana!
La comida y los desayunos son muy buenos."
"Republik","lastima la atenciòn","La comida es excelente,  lastima el servicio de varios meseros con su atenciòn demora en atender las mesas que se encuentran ocupadas, le pediria a los propietarios del restaurante, que contraten gente especializada y con capacidad de prestar un excelente servicio.a los clientes."
"La Fragata Giratorio W.T.C.","Puro nombre! Regular...","Pedimos, entre otros platos, arroz de camarones el cual parecía un arroz común y corriente con uno que otro camarón, sin mayor sabor ni gracia para el precio. La porción no es grande y si lo fuera con ese sabor, tampoco sería agradable de comer...Más"
"Salto del Angel","Ruidoso, mal servicio y para los jóvenes","Reservamos una mesa para 25 y dijeron que sólo teníamos 19 asientos y que comienzan a perder esos asientos si no podíamos ocupar delante de todo nuestro grupo encender!!
Si quieres hacer alarde de su vecino y nada más sobre comida mediocre y pobre servicio,...este es el lugar para ti. pequeñísima boppers sólo.Más"
"La Chorizeria","No tan buena mi experiencia","Si bien el sabor de su comida es rico, la atención no fue la mejor, se demoraron en traer el plato a la mesa y cuando fui a pagar, la cajera no me entrego factura y cuando se la pedí me fijé que me había...Más"
"Taj Mahal Indian Restaurant","Mal servicio","Aunque la comida no esta mal, tampoco es de resaltar. Pero el servicio al cliente es muy malo, el personal no es cortes ni atento al atender y tampoco proactivo, es decir a menos que tu preguntes los detalles no se anticipan a dartelos. No...Más"
"Plaka","Decepción","Fuimos a cenar y nos hizo una reserva. Nos pusieron en una pequeña mesa en la esquina, no tienen el vino que quería y la comida era muy variado. Mientras mi mujer estaba encantado con su tartare de salmón y risotto, puedo era extremadamente decepcionado...con mi chicharrones de pulpo y vale la pena el cerdo Lechal, que estaba seco y duro y ahogados en una piscina de overpowering smell salsa. No podría incluso comer un tercio y mencionar que el maitre, él dijo que hablar con el chef pero ni siquiera nos molestamos en volver a nosotros o ofrecen una sustitución. Pagamos la factura, así que tuvimos que abrir la puerta restaurante nosotros mismos y no volveré otra vez, solo recomiendo este lugar a cualquiera.Más"
"Castanyoles","No es un buen restaurante español","Hago un comentario de los platos que hemos pedido durante un almuerzo:

- Salmorejo: estaba bien, añadiría un poco de huevo cocido y un chorrito de aceite de oliva virgen acompañando el jamón.

- Pulpo a la gallega: creo que deben aprender a cocinar este...Más"
"7 16","Almuerzo","Es un restaurante especializado en carnes, tambien tiene tapas y pescados. No  nos fue bien con el almuerzo, no volveremos. Aunque la carne estaba rica, el termino era incorrecto. Casi toda estaba bien asada, con muy pocas partes termino medio, que fue el que se...Más"
"Bogotá Beer Company","un bar mas","nada especial, otro invento mas de pup de esta ciudad, pesimo el servicio, uno por lo general busca encontrarse con los dueños en estos lugares como en londres, aca la atebcion es mala, nadie quiere saber de uno, recomuendo en usaquen, ocho campanas"
"restaurante mirador la paloma","Agradable lugar, pesimo servicio","El lugar es muy bonito y agradable, sin embargo el servicio es pesimo: el mesero no conoce el menu, se tardan mucho para traer los alimentos y bebidas. Ademas el dueño grita y trata muy mal a sus empleados"
"Nazca","pequeño, caro, frío, lento y salado","los sabores no están mal sin ser la locura, aunque salado para mi gusto pero igual comestibles, lo que no compensa su excesivo costo, que tampoco halla justificación en sus mínimas porciones y para completar tardaron 40 minutos en traer una entrada y un fuerte...Más"
"Cafe Amarti","No es bueno","Visitamos Cafe Amarti con un grupo de amigos para comer hoy:lo único positivo que puedo decir de este lugar es que tiene un ambiente agradable. El camarero nos mostraron poco interés en busca de nosotros. En varias ocasiones tuvimos que pedir que lo atendía. Pedí...una copa de vino de la casa tras pedir primero el precio. El camarero nos dijo que era Ps.14,000 pero cuando llegamos la factura era de hecho Ps.18,000. La comida era mediocre. Pedí una lasaña, que llegó con el acompañamiento (una ensalada habría estado bien) y era muy grasosa. Ninguna de las comidas ordenados por otros miembros del grupo parecía atractivo.
Para comida italiana en Bogotá, hay ciertamente mucho mejores lugares para comer y donde el servicio es excepcional. En el futuro si quiero comer comida italiana, que se pegan a di Lucca.Más"
"Tasca, la Puerta de Alcalá","No llene mis expectativas","Dificil encontrar un buen restaurante español en Bogotá.
Fui esta semana y pedi paella valenciana, pero no saben como es la verdadera paella valenciana pues la autentica es con conejo y pollo.
Regular la que me sirvieron."
"El Butcher","Mejores opciones por ese precio","La carne muy normal, la atención pésima, no había casi gente y aún así se demoraron tanto para atendernos como para traernos el pedido, quien preparo las papas estaba emocionado con la paprika, era paprika con papás, por ese precio muchas y mejores opciones sin...Más"
"El Corral Gourmet","Uno pide ensalada, pero","si ponen aprox. 10 cm de cebolla frita encima de una buena ensalada... ¿¿¿Para qué ??? La limonada de coco era REALMENTE asquerosa, coco rallado mezclado con limonada, en total: muy mejorable."
"La Diva Pizzería","La primera vez excelente, pero...","Segunda vez decepcionante.

El sitio es acogedor y con una decoracion muy especial. La primera vez probe la pizza de datiles y jamon serrano. Sinplemente de las mejores que haya comido en Bogota.

Para la segunda vez pedimos una pizza vegetariana. Terrible. En realidad debimos...Más"
"Chicheria Demente","Normal","Fui con gran espectativa pero no fue gran cosa, los platos son pequeños, mas bien como tapas, es un poco frio y tiene aspecto de bodega, la comida esta bien preparada, tiene valet parking, el servicio fue bueno, pero los precios un poco alto para...Más"
"Kfc","Pesimo","Es una lástima que estén disminuyendo la calidad del pollo; presas dIminutas, el pollo tenia mal olor y le falto cocino; pero en especial el sabor original de KFC se ha perdido;"
"Bistronomy by Rausch","decepcionante","Dos en nuestro grupo pidió negro linguini con camarones: la pasta no tenía salsa, apenas algunos suaves como caldo en el fondo del plato. pedí el plato del día, chucrut, y el plato venía con varias piezas de salchichas y la carne, unas patatas en...un caldo, y no chucrut, 20 cuerdas de col que probablemente hizo a mi plato wheh estaban medición de las carnes para servirlos en el plato. Pedí una porción de choucrute a un lado y me trajeron algunos. No estaba mal, nada para recordar. Para la reputación de los cheffs, la comida fue muy decepcionante. Una cosa buena, el pan.Más"
"Cafe Amarti","Desmejoro mucho","El restaurante ha desmejorado mucho 

Asistia con regularidad pero desmejoro y ya no lo recomiendo 

El pan sapo q es la cortesia de la casa"
"Gostinos","Muy, pero muy regular","Los ceviches no tienen la calidad que exige este plato y así los demás que ofrecen. El lugar es adecuado y bien presentado, y la atención es aceptable. Pero la comida es para no volver."
"El Patio Restaurante-Cafe Bogota","ESPERABA MUCHO MAS !!! NO ME GUSTO","ESPERABA MUCHO MAS !!! NO ME GUSTO"
"El Arca","Muy demorado y nada especial","Fui un domingo por recomendación de unos amigos. Después de una fila de casi una hora, y de otra hora de espera luego del pedido, la comida me pareció un poco sosa y floja de sabor. El precio no obedece al servicio deficiente y a...Más"
"Osaki 118","Pedido para llevar","Pedí un pollo coreano para llevar y me desilusiono total . Vino sin acompañamiento , y nada q ver con el tipo Críspulo q deguste la primera vez en la 93"
"Brangus Steak","¡Muy pobre!","Decepcionante, muy malo, las costillas BBQ son terribles. Muy costoso para lo que ofrecen. No vale la pena."
"Sir Frank Hot Dog Joint","Esta desmejorando","La primera vez que fui salí pensando que era un excelente lugar, sin embargo esta última vez algunos detalles dañaron la experiencia. 
Me tomaron dos veces el pedido y aún así lo confirmaron una tercera  después de un muy buen rato, finalmente olvidaron uno de...Más"
"Rock'N Stop","No fue lo que esperaba","No sé si me había generado una imagen diferente, la atención deficiente, esperamos casi 20 minutos la cuenta y al final nos tocó ir a entregar el dinero en caja, pedimos la picada para ""4"" pero realmente es para dos personas y hay elementos que...Más"
"Frida Restaurante Mexicano","Pero el servicio de buen carácter fue la peor","Es un lugar agradable con un ambiente mexicano. El propietario es muy amable y con entusiasmo saluda a todo el mundo entrar. Él inmediatamente me dieron un menú y preguntó qué quería beber. La bebida y la comida llegó bastante rápido y la comida no...estaba mal, no era picante pero tenía sabor. Me hubiera gustado un poco de salsa caliente, pero los camareros desaparecieron. Por el momento he visto un servidor, yo diría terminado y él me ignoró de todos modos. Después de terminar mi comida, esperé otro 25 minutos para ver un servidor para pedir la hora. Me trajo la hora de volver y poner el dinero necesario. Lamentablemente necesitaba cambiar. La hora sentado allí por 37 minutos antes de que finalmente se levantó y pareció que el propietario a pagar. No hace falta decir que, incluso con la mejor comida en el mundo, no estoy esperando tanto tiempo para simplemente pagar y salir.Más"
"Tandoor Indian Food","Decepcionada","La experiencia fue desde el principio desafortunada. El servicio, pese a que si parecen conocer bien el menú y son amables, no se ve experiencia en la atención, ni están pendientes de detalles tan simples como las servilletas y cubiertos.  
Sobre el menú: amplio pero...Más"
"El Corral Gourmet","No Vuelvo, Me Quedo con El Corral Original","Si están pensando en Hamburguesas es mejor que vayan a El Corral Original y no a El Corral Gourmet, pues en este ultimo la carta si es cierto que es mas variada, pero también es mucho mas cara.

En cuanto a las Hamburguesas no veo...Más"
"Brasa Brasil ","FUE BUENO HACE MAS DE 20 AÑOS","Fuimos a la sede de la avenida la Esperanza. El local nuevo, la decoración bonita, la música... no se escucha; el servicio muy bueno, pero la comida... muy regular; increíble que el rodizio ya no sea su fuerte, hay mejores platos, como el Steak a...Más"
"La Mar","muy caro y nada bueno","Definitiamente el costo es mucho para la comida que sirven. Mi plato estaba lleno de harinas, y de mariscos casi nada, eran por mucho 5 camarones en un plato de mariscos."
"Jungla Kumba","Cumpleaños","El servicio es muy demorado el personal no se interesa en atender a los visitantes cuando llegan los alimentos ya están fríos y al dueño no le interesa por que igual el sitio se la pasa lleno. La idea es innovadora pero si deben mejorar...Más"
"Gigi's","Podría ser mejor","Tuvimos el corte de lomo con Manhattan vestidor y lamentable fue crudo, como bruto bruto, así que nos envió la próxima vez que trajeron fue mucho mejor. También tuvimos la ensalada vegetal y solicite para añadir gambas. Las bolas de queso en la ensalada estaban...bien, pero aparte de eso nada especial, también me cobraron 10 mil pesos para añadir 5 gambas tigre a los más pequeños.Más"
"Restaurante Yanuba","Sunday Brunch (sabor menos comida).","Hoy visitamos Yanuba un brunch los domingos con mi hijo, impresión general insípido presentación de la comida horrible, lento y confundido el servicio. Más no siempre es mejor, un montón de camareras, pero no había orden y coordinación.

Café y zumo llegó después de la...comida, y después de haber preguntado 3 camareros diferentes si podían traer.

Pedí huevos rancheros, que era más como una sopa aguada, con dos sunny hasta huevos, cesta de pan con pan sin sabor, la levadura natural más sobre pan ultracongeladas comercial recalentado, mi hijo ordenados tortitas con bacon, bien media y tres pequeñas tortitas de bacon tibios. Café y zumo de lulo descenso, este se dice que es uno de los mejores lugares en Bogotá para el brunch, no entiendo por qué, nunca mirando el oscilan la media de edad de la clientela parece más un lugar de reunion para mujeres. jubilado vieja Precio bien 50. 000 cp para lo que pedimos, no exageradamente caro, pero por lo que se sirve, no mejor en casa, incluso si no es un chef. No recomiendo. . . . .Más"
"Pesquera Jaramillo Santa Barbara","Muy costoso para la calidad del servicio","Es un restaurante muy costoso para la calidad del plato y el servicio, la cazuela de mariscos es exageradamente costosa para la calidad del plato y su sabor nada recomendable pedir esta opcion"
"Rock'N Stop","Una MUY mala experiencia","Fuimos por el cumpleaños de mi hermano y la verdad mucho que desear, le falta tanta administración, muy demorado la entrega de la comida cuando eramos practicamente los únicos, los meseros peleando en frente de nosotros sin importarles nada, siendo domingo no había guacamole ni...Más"
"Desayunadero El Canon del Chicamocha","Deliciosa comida, pésimo servicio","De nada sirve que la comida sea deliciosa, si te la dañan con el servicio. / Atienden 24 horas. Muy buenos platos y porciones. Tienen parqueadero, pero al llegar el celador no me vio llegar por estar chateando, y al salir solo más vio tomando...Más"
"Archie's","Decepción","Tenia una buena percepción de este restaurante, pues hace mucho tiempo había ido y me parecía súper. Hace como 2 semanas fui al que queda en el parque de la 93 y terrible! Pedí raviolis y sin mentir no venían mas de 10 raviolis que...Más"
"Cafeteria Rausch Brothers","Normal y Caro","Pedimos Bagel y Sándwich frío, con batidos, el bagel muy normal, lo único bueno era el jamón serrano, el sándwich normal tirando a malo es uno que podría hacer en la casa, y dos batidos también normales, caro porque sólo estas cuatro cosas sumaron 90.000...Más"
"P.F. Chang's","No lo recomiendo","Restaurante malo y muy caro. La comida no tiene sabor asiático. el Pad thai muy malo. La entrada que pedí estaba fría. La atención es buena."
"80 Sillas","No vuelvo","Simples ceviches de solo tilapia y salmon, insipidos y nada buenos, pedi tartare de atun y no hay, unas ginebras mal servidas en cantidades minimas y un lento servicio, la entrada de atun lo unico que se salva, el carpaccio de lomo muy grueso y...Más"
"Salto del Angel","Pésima musica","Fuimos con mi esposa a celebrar mi cumpleaños, la cena estuvo bien, sin embargo el mesero no estaba pendiente, tocaba llamarlo cada nada, bueno esto se pasa pero lo que nos irrito fue la musica,un dj durante 5 horas, canciones repetidas,  señores dueños el pobre...Más"
"La Romana: Av. Jiménez","Los platos fuertes NO son su fuerte!!","No se porque insisto una y otra vez en dar la oportunidad a este sitio, será porque me trae muy buenos recuerdos de mi infancia y las onces (chocolate con canastillas de panes y su deliciosa mantequila) que disfrutaba con mi familia y siguen siendo...Más"
"NN Food Hall","Gran ambiente, comida normal, pésimo servicio.","Para ser sincero, no me he divertido en este restaurante. Para empezar, yo no sabía lo que estaba haciendo. Ir a la tienda fuera, pasando por las cocinas así cuando llegue, el comedor principal"" está justo en los ojos. Me gusta el concepto, es precioso,...muy bien decorado y tiene un tema ... lo que es muy importante.

donde lo hace todo ir mal? el servicio.

sólo porque su restaurante es espejos para atraer a ciudadanos de segunda clase superiores, eso no significa que su personal de servicio debe menoscabar quien contempla su menú y no entendía lo que se propone. Esos fueron los parece que pedimos explicaciones.

Se trata de un ""entusiasta"" en el mejor lugar. abrumador overwhemingly menú para un hermoso lugar. caro para la comida normal.

¿volvería? no lo creo. Quizás para los cócteles que era genial!

No recuerdo la comida, solo la mirada gruñona del personal por no saber qué iba a pedir ... Espero que me recuerda la comida, pero los camareros no me dejaron.Más"
"Pesquera Jaramillo Parque de la 93","SOLO NOMBRE","Con mucha expectativa visite el restaurante a la hora del almuerzo, pedimos Cazuela cartagena y cataplana de mariscos que es un plato para dos, no tengo reparos en el sabor, pero el nombre y el precio le  queda grande a la cataplana, $70.000 mil pesos...Más"
"Juana la Loca","Regular la comida y malo el servicio","Fuimos en las horas de la
Noche para cenar mi esposo y yo , pedimos un pescado encostrado  en hierbas y tomate y unas pastas con burrata y tomate, acá les dejo las fotos.
Realmente el pescado era dificil de comer estaba en una base...Más"
"El mejor ajiaco del mundo","basico","lugar claustrofóbico, variedad inexistente (tres platos)servicio despistado aunque rápido, un solo baño para ambos sexos....precio? caro para lo que es y donde está."
"Restaurante Tipico Italiano Giuseppe Verdi","Un servicio pésimo  y trampas en la cuenta","El plato estrella es muy bueno, lo demás  pésimo.  Casi te obligan a pedir lo que sea adicionalmente.  Ensaladas de mínima calidad, hojas de apio. Y postres partidos a mitad. No les interesa el cliente . Solo lo que pagas."
"P.F. Chang's","Mediocre","Prácticamente no hay opciones de platos que no sean agridulces. El servicio poco ágil, pedi sal y no tenían ni saleros. Recomendable solo para personas que les gusta la comida agridulce."
"Beer Beer Company Parque de la 93","LLenisimo mesas muy pegadas y los precios too much para lo que es.","Las mesas son tan pegadas y el sitio se llena tanto que uno termina casi que opinando de la conversación de la mesa vecina. de precios caro para lo que es. Hay mejores cervecerías en Bogotá.

No lo recomiendo"
"Mi Calle","No es un restaurante mexicano","La comida es pobre en sabor, los nachos fueron totopos con un poco de guacamole y frijoles sofritos, realmente pobre, la sopa mexicana le faltaba mucho sabor, la carne con chilaquiles, eran 200 gr de carne con totopos con queso encima ni salsa ni nada,...Más"
"Centrico Restaurante Bar","Podria ser mejor","La vista es buena, pero la atención de los meseros muy deficiente, la musica con bastante eco poca acustica y solo el género regeaton podrian variar un poco."
"7 16","Una mala experiencia","Lastimosamente debo decir que mi familia y yo pasamos una mala experiencia en este restaurante. Fuimos con el motivo de celebrar un grado y salimos todos (6 personas) intoxicadas. Todo apunta a la entrada de mariscos que fue lo que comimos en común ese día....Más"
"La Santa Guadalupe Bogota","Muy regular","El lugar es bonito, visualmente es agradable. Al estar adentro las sillas son incómodas, el servicio regular y se demoran en servir, para traer una comida mala. Pedí las costillas de cerdo que estaban llenas de salsa, super hostigantes. La comida muy regular, la entradas...Más"
"La Plaza de Andrés","45 minutos demorado","Pésimo servicio, éramos 6 personas y traían una cosa cada vez, primero un café, luego un jugo, después un capuchino y lo de comer 45 minutos después!!!!!"
"Teo Estiatorio","No vale la pena una visita","El servicio es mi comentario positivo. El salmón estaba daba y mal condimentada. sólo había un vino por copa que era terrible. La ensalada griega estaba bien, pero nada especial. Todo por un precio muy alto."
"La Grande Cantina Cevichera","Demorado sino y baja calidad","Se tomaron casi 40 minutos para traer el pedido, lo trajeron por partes, y la excusa es q estaba muy lleno el lugar, entonces planifiquen que no pueden atender bien y pongan menos mesas.
El arroz con camarones, traía solo 2 camarones, la segunda bebida...llegó poco antes de la cuenta, muy mal servicio.Más"
"Cosette","Mal servicio","Esperé más de 15 minutos para que alguien tomara mi pedido. Simplemente me fui, hay muchas otras buenas opciones en el área."
"La Hamburgueseria","Buenas Hamburguesas al carbon","Buenas Hamburguesas al carbon"
"Mini Mal","Atención pésimo","Acababa de llegar a Bogotá y la persona con la que fuimos era vegetariana, por eso seleccionamos éste, - ella es vegetariana- al preguntar si podíamos tomar un vino que traía en la maleta a la mesera, ella le pregunto a la encargada una señora...cómo del pacifico y nos dio la espalda. Nunca contestó. Ni a la mesera ni a nosotros. Después de ese desplante y al ver que nos dejaron hablando sólos, no tuvimos más que irnos. Fue una situación incómoda y groseraMás"
"Hooters","puede mejorar","Todos sabemos el concepto Hooters alrededor del mundo. vas a Hooters no sólo para alimentar a su estómago sino también sus ojos. Aquí en Bogotá la comida es de calidad media y el comportamiento del personal, de las hembras positiv o , principalmente, es una...especie de ignorantes y snootily. Hay muchos otros pero mejores lugares a donde ir.Más"
"Azimos","excelente pero lento","Muy buen café y pastelería, por ser paciente, se tarda mucho tiempo para comer. Excelente ambiente aunque . Buena ubicación."
"Pesquera Jaramillo Parque de la 93","No es genial.","Mi experiencia de restaurantes en Bogotá (y fuimos a muchos de ellos) es que cuando intentan hacer exclusivo, terminan overwrought y poco satisfactoria. Los pequeños detalles, como saltines en vez de pan con una variedad de peces, señal que esto sería una cena mediocre. El...servicio era demasiado cargada, y la comida dejaba mucho que desear. Mi impresión es que, a pesar del hecho de que la zona del Parque de la 93, donde PJ está situado, es conocido como el restaurant row de Bogotá, de hecho, es más sustancia que sustancia.Más"
"Capitalino Restaurant","DECEPCION","Lo primero que quiero decir es que estos comentarios constructivos los quiero hacer de cara a que se supone que haremos referencia a un restaurante de primer nivel de la ciudad de Bogota. El dia de ayer estuve con mi familia en horas de la...Más"
"69 Gauchos Bar & Grill","Porciones pequeñas y carne mal preparada no en el término pedido!","Mala experiencia la carne no estaba en su punto llegó casi cruda y las porciones son muy pequeñas!! Bad experience no lo recomiendo"
"Shamua","Mal servicio","Es un lugar neutral para pasar tiempo con amigos, la comida no es del otro mundo pero los cócteles son muy buenos, lástima la atención que me toco hoy. Pedimos la carta 4 veces y finalmente la administradora nos la entrego y luego 30 minutos...Más"
"La Puerta de La Tradición","solo tomamos unas cervezas y no estaban frías","Paramos a tomar una cerveza en este lugar por su ubicación tan buena, pero la verdad es que no estaban nada frías. Una pena. Pedimos la Club Roja (4.500). Servicio atento. Carta colombiana"
