"nombre","titulo_comentario","contenido_comentario"
"La Hamburgueseria","Mal lugar","Muy mal servicio, no preguntan los términos de las carnes, los traen mal, no traen las bebidas , los meseros (todos) miran mal al atender, se envolatan, el jefe de meseros se la pasa hablando por celular y se demoran en traer la cuenta, no...los recomiendo el buen nombre que tenían ya no existe no se pierden de nada,  en buenas hamburguesas recomiendo otras opciones y si las ganas son de hamburguesas smdistintas recomiendo ""El taller"" también en usaquen delicioso y el servicio muy buenoMás"
"Viva la Vida","Mala experiencia, no recomendable","Fui a almorzar y al llegar había un olor muy desagradable en área cercana al bar  por lo que decidieron trapear el piso  al lado de donde estábamos  con toda clase de limpiadores durante la mayor parte del almuerzo, fue muy desagradable....... y adicionalmente llego...Más"
"Hacienda la Margarita","MALTRATO","Utilizan a los animales como espectáculo, maltratándolos y poniéndolos en peligro, es denigrante. Los dueños de este lugar no tienen el mínimo de compasión por ellos, sólo quieren ganar dinero, la comida ni es tan rica y muy costosa"
"restaurante mirador la paloma","Increíblemente malo","Solo cuentan con dos cartas para todo el restaurante. Una pechuga común y corriente cuesta $40.000 sin acompañantes, no tienen jugos, no tienen coca cola, no tienen agua.. Lo peor de todo es que siendo un ""restaurante"" exigen un consumo mínimo de cervezas y cócteles...Más"
"La Vecindad - Mexican Grill","MALO EL SERVICIO","muy buena la comida  pero el servicio malisimo no hay quien reciba a los comensales y ni mucho menos que esten pendiente de sus pedidos y tampoco un jefe que este pendiente esta clase de irregularidades en el sitio que malll y ademas el plato...Más"
"restaurante mirador la paloma","Son unos ladrones sin tapujos","Es una vergüenza, es un negocio que consiste en robar descaradamente a los clientes. Pertenecemos al gremio de la hostelería y hemos estados en MUCHOS restaurantes y bares, en diferentes partes del mundo y NUNCA, NUNCA habíamos tenido la sensación de atraco absoluto como en...Más"
"Centrico Restaurante Bar","Cancelación de reserva a última hora","El día de hoy a las 4 de la tarde recibimos un sms cancelando nuestra reserva hecha el día lunes de esta misma semana, tratamos de llamar para saber que había pasado y nadie fue capaz de contestar, es el colmo la manera en que...Más"
"Diner","Siquiera para el desayuno","Ruido .Frio. Incomodo. No es la primera vez que voy. si fué la última. El desayuno tal vez le agrade a los colombianos  no a quién no almuerza a las 8 de la mañana."
"Pajares Salinas","Pésimo !!","Fuimos con mi familia, cargados de expectativa. 
El lugar ... agradable, bien decorado y buen ambiente !!
La comida ... TERRIBLE. Pedimos varias entradas y lo único rescatable fue el jamón de bellota. Las txistorras estaban sobre cocidas y con muy mal aspecto, las rellenas,...Más"
"Kfc","No atienden hasta la hora adecuada","No atienden hasta la hora que promete el establecimiento, dicen hasta las 9 de la noche y faltando hasta 15 minutos ya no preparan nada por que están cerrando, oficina de centro chia"
"Rosita Restaurante Café","Lamentable servicio","La comida es normal, mediocre diría, el precio bastante elevado para el país y la calidad. Lo peor de todo fue que no nos permitieron pagar con tarjeta, y no nos avisaron hasta traer la cuenta."
"Gyros & Kebab","Simplemente terrible.","Las porciones son muy pequeñas, la mayoría de la comida que pedimos estaba fría cuando servían. Hay opciones mucho mejores para comer en Bogotá."
"La Plaza de Andrés","Pesimo lugar. Gerente muy Junior.","Despues de algunos años de querer regresar a Andres, dos días antes fuí a Andres Carne de Res, en el centro de Bogota y me fué increiblemente bien. Para despedirme de lujo, ya en el aeropuerto fuí a ésta nueva sucursal, en el entendido de...Más"
"Gordo Brooklyn","El servicio de abismal","Intentamos conseguir im dos veces en la misma noche. Mismo servicio horrible. Es como si te estuvieran haciendo un servicio lo dejan en. Primera vez, la ""anfitriona"" dijo que no hay mesa, así que por favor deje. Nos fuimos. Decidimos volver para bebidas un par...de horas más tarde, ya que nos encontramos cerca de la puerta un camarero sale y dice, ""no hay servicio"" y cierra la puerta en nuestras caras. Es curioso que piensan que tienen que soportar todo esto, cuando hay muchos buenos restaurantes de la ciudad. Sáltate el bombo y ve a otro sitio donde servicio de atención al cliente es un concepto importante. Nunca volver y no se lo recomendaría.Más"
"Cabrera Resto-Bar","Pésima gestión para reservas","Cómo es posible que me digan en la página de internet que me van a confirmar en unos minutos la reserva cuando la realidad es que la confirmación es entre 12-18 horas? Porque si no hay aforo para un día, mostrarlo así en la página?...Más"
"Beirut","Almuerzo de domingo","La comida es buena pero el servicio es terrible. Es carisimo para lo que es. Los meseros no estan pendiente de recoger los platos ni de tu comodidad en el restaurante. no lo recomiendo"
"La Picaderia","Mala experiencia gastronómica","Nos sentaron en una mesa de afuera, pedimos una mesa adentro y nunca nos consiguieron. Afuera hacia frío, estaba lloviendo, la atención muy lenta, los platos se enfriaban, la calidad de la comida no es buena. Muy inflexible la carta porque de los platos no...Más"
"Trattoria de la Plaza","Pésimo un engaño","Si usted no tiene reserva ni se acerque lo engañan a uno diciéndole que está de primera en la lista de espera y resulta que usted está esperando que desocupen por un tiempo no menor a una hora y media espantosa experiencia"
"Rosita Restaurante Café","Ingenuo","La comida era muy buena. Hijo del dueño se ofreció a conseguir un paquete de sigarettes. Le dieron el dinero, pero él no volvió. Después escuchamos que un adicto. Evitar."
"Uma Cantina Peruana","La comida no cumple expectativas","El pulpo estaba baboso, no al punto. El ceviche, la corvina estaba aún congelada y sin sabor. La atención es muy buena pero lastima los platos."
"Carnivoros","Pésimo servicio y la carne","Pésimo servicio y la carne muy regular, solo Tulio y las fotos hablan bien de su comida porque la realidad es muy distinta."
"La Cerveceria","Pésimo servicio","Intenté explicarle 10 veces al personal que diera ejemplo com el baño. Los hombres entraban al baño de mujeres y no les importaba. Groseros y sin educación."
"Frisby","Queja ante secretaria de salud y superintensencia","Frisby Girardot, Enero 31: suciedad en el piso y las mesas, la zoma de basuras a rebosar de despereicios de alimentos, el pedido 19 rodo de la cocina a la mesa de entrega mas de 1 hora donde varios clientes hablaron encima de este Sin...tapabocas, dijeron tiempo de espera 30 mnts y llevaba 1 hora por lo cual me acerque a solicitar lo comprado, el personal muy grosero, No cumplieron con el numero de orden asignado y la Administradora que observo desconoce normas de manipilacion de alimentos y manejo al cliente responde: el numero no interesa.
Paso seguido seguia rondando la comida servida del oedido 19 a pesar de yo insistirle que estaba contaminado por que llevaba 1 hora servido y varios clientes hablaban queja dose de la demora encima de este.
Pesimo servicio...la solucion? Que nos devolvia la plata...cua do vio que eramos 5 clientes insistie do en que respetara el orden de los pedidos se escondio en la parte de atras de  la cocina.
Inaudito el maltrato al cliente,la NO limpieza a mesas, piso y canecas, es una porqueria ese local y  denunciare abte secretaria de salud y super.Más"
"El Mat Tapas Bar","Sabrosura","Increíble sazón, me recuerda los deliciosos sabores de la India, difícil de encontrar en Bogota, simplemente increible"
"wok","PESIMOS PLATOS A DOMICILIO","Pedido a domicilio: tempura KO y arroz cantonés. Mala presentación y sabor de los platos, utilizaron vegetales viejos en el arroz cantonés. Ni para regalar a alguien necesitado. No volveré a solicitar a este restaurante, que viene deteriorando la calidad de sus platos."
"La Fabbrica","Una decepción, comida cruda","Pedí un plato de pasta larga con camarones y azafrán y los camarones llegaron crudos y muy desabridos. La salsa no tenía nada de azafrán ni ningún condimento que le diera sabor. Hasta el momento lo peor de bogotá."
"Abasto","Una cucaracha en la mesa","Regular servicio
Comida normal y cara
Hoy al levantar los platos de la mesa había una cucaracha debajo de uno
No dije nada porque yo estaba invitada...."
"Tomy Tomato Pizza","la gran estafa","hoy por fin probé esta famosa pizza  , debo decir que tenia ganas de probarla.
de entrada creo que te atienden mejor en un mc donalds , precios y producto final muy malo , pedí una bufala supuesta mente una pizza con mozzarella di bufalla...Más"
"restaurante mirador la paloma","Estafa","Pensé que era a la única que me había pasado, pero leyendo los comentarios me doy cuenta que este lugar realmente es una estafa. Para empezar no tenían nada de los que pedimos, comenzó a llover y nos cayeron goteras  y al final no nos...Más"
"Buffalo Wings","Alitas frías","Las alitas no fueron los que esperaba comparado con visitas anteriores en el mismo local. 
Pedimos 20 alitas, 10 llegaron calientes y 10 HELADAS, no entiendo cómo un lugar de alitas vende alitas FRÍAS."
"Jungla Kumba","Comida horrible y pésimo servicio","Es un restaurante con una ambientación muy bonita y llamativa para los niños. Sin embargo la comida es de lo peor que he podido probar, el servicio es demorado y poco amable. Antes daban el brazalete para los juegos por el suplicio de comer sus...Más"
"La Santa Guadalupe Bogota","Pesima experiencia... Hay opciones mucho mejores","Fui a cenar el lunes de la semana pasada con mi esposa, el lugar es muy lindo pero realmente fué lo único bueno de la noche. La comida estuvo muy mal, en especial el pozole (mala presentación, frío e insípido... peor no pudo estar). Está...Más"
"Archie's","incomible. Archies de Usaquen","Que mal Archies, me mandaron un pedido mal y cuando lo cambie me enviaron un carpaccio de salmón q sabia a pescado podrido. La verdad incomible. 
Q mal q una empresa que fue tan buena, ahora sea un lugar de mala calidad y pésimo servicio....Más"
"restaurante mirador la paloma","Leer otras críticas antes de ir en","Es un robo total. No quisieron traer nuestros platos principales porque no sabíamos pedir cerveza. Sí, creo. Pregunté a la camarera sobre los menús y parece que ella había sido contratado 5 minutos antes de tomar nuestra orden. El dijo que no lleve coca cola,...pero en la entrada dice ""restaurante"". El propietario reqyested espantados cuando habla con la persona a cargo. Se puede ver que las cosas no están muy bien hecha por allí en todos los sentidos. Manténgase alejadoMás"
"Nazca","Lo peor de la zona G de Bogotá","La entraña quemada dura incomibles, los tallarines duros y pegados, como recalentados con microondas, los langostinos gomosos, y la trucha con grasa .ni idea de cocina Peruana, salvo por los tragos.
Caro para la pésima calidad de los platos! No comimos nada, volví a cenar...a mi hotelMás"
"Jungla Kumba","Terriblemente costoso","Es terriblemente costoso no solamente la comida que es poca y nada del otro mundo, si no además cobran el parqueadero, los juegos de los ninos. Y aparte tienen un almacen para vender un monton de cosas."
"Rock'N Stop","Lunch","Me llamó la atención el sitio por su aspecto exterior, revisé el menú y decidí almorzar con mi familia. 
De entrada pedimos Búfalo Wings que resultaron fatales, estaban hervidas, con la piel grasosa en lugar de fritas y crocantes, la salsa era una mala aproximación...Más"
"Upper Side 81St Street","Mal servicio/mala comida","Mi experiencia en Upper side fue terrible, fui con mi pareja a tomar unos tragos y algo ligero de comer. Desde el comienzo la atención fue muy descortés, el mesero prácticamente nos tiró las cartas, pedimos vino y unas entradas para acompañar, los platos estaban...Más"
"7 Cabras","Muy Malo!!!","Realmente la comida no es lo destacable de este sitio. El lugar es bonito sin ser nada especial. Pero de verdad la comida es mala. Los langostinos crujientes feos, las chuletas de cordero insípidas y mal hechas. Preferí no seguir comiendo para no tener peores...Más"
"El Cielo Bogota","Pretencioso","Lo más razonable y odioso lugar. Algunas cosas eran interesantes mientras se mira en ellos, pero los sabores son escasas. la factura era exorbitante, incluso en dólares. Me fui con un montón de ideas de lo que los restaurantes ofrecen era, terminó siendo algo frío...y sin personalidad. Qué pena.Más"
"De Una Travel","Lo peor","Salí indignada de ahí. La peor atención que he tenido en MUCHO tiempo. La comida simple, aburrida y FRIA! Para no ir, a no ser que se este muriendo de hambre y no tenga otro lugar donde ir.. como me pasó a mi.Más"
"Kokoriko","Pollo quemado y viejo","De toda la comida y domicilios que he pedido a kokoriko, jamás había recibido tan mala atención como la de hoy en plaza de las América en la plazoleta de comidas en bogota. Pedimos con mi acompañante un filete de pollo y no lo dieron...Más"
"Apache Bar","Pesimo servicio","Llame a preguntar horarios de atencion y si podia hacer una reserva antes de ir y despues de una pesima atencion via telefonica y decirme que era por orden de llegada y dependiendo de con cuantas personas iba “miraban si me podian ubicar”, trate de...decirle a la señorita que era una fecha especial para ver si me podia ayudar con reserva, pero la señorita colgó el telefono groseramente antes de poderle decir algo.

Si asi es por telefono no me genera ningun interés ir al sitio a que me traten mal.Más"
"Mi Gran Parrilla Boyacense","Comer  acá es apoyar  la explotación  laboral","Trabajé  en este restaurante  7-8 meses, no pagan prestaciones , los jefes humillan y  tratan  mal y además prometen a lps trabajadores  almuerzo y les dan un almuerzo denigrante  (papa y arroz y listo)
A los empleados de tiempo completo lps hacen trabajar mas de...Más"
"Balsamico","La peor experiencia del año","Al escribir esta opinión, debo decir que estoy enfermo por el daño que me hizo la comida, al igual que a mis acompañantes, aunque todos pedimos platos distintos. Carne podrida, pasta sin sabor pero con productos lácteos viejos. Y como si esto no fuera suficiente,...Más"
"Archie's","Pésimo!!!!!! NO RECOMENDABLE","Jamás en mi vida me he sentido tan maltratado como cliente, el servicio pésimo, ordené un atún que estaba incomible, cuando pedí por otro plato me tuvieron como 30' mas desatendido. Finalmente me marché sin que me atendiesen y sin comer. NO LO RECOMIENDO PARA...Más"
"Arigato","Pésimo servicio y condiciones de higiene","Fuimos a Arigato con mi pareja a conocer el restaurante, dado a que estudiamos muy cerca y al revisar los comentarios del lugar, consideramos interesante, ir en la hora del almuerzo. Llegamos sobre las 12:40 pm de la tarde de un sábado, y ordenamos cada...Más"
"Patacones food and gallery","Comida fría y mala atención","Me sirvieron el plato de camarones los cuales venían fríos y me intoxique con ellos, cuando me los sirvieron con poca cantidad de camarones (ver foto). Una experiencia realmente mala"
"Cenizo - A la leña","Mal todo! Masa de la pizza, el término y sabor de la carne...fatal","Masa de la pizza dura y quemada, la carne completamente 4/4 (habiendo pedido consejo del parrillero, porque es un restaurante de asados y ahumados), dura, sabor a quemado, tuve que devolverlaMás"
"Jungla Kumba","Para nunca volver!!","Pésima experiencia en este lugar, llegue con mi esposa a comer el sábado 5 de noviembre a las 9:30pm, pedimos unas cervezas, entradas y platos fuertes... Nos trajeron las cervezas y solo una de las entradas.. esperamos mucho, el mesero informó que ya nos traería...Más"
"Dhaba","La buena comida no compensa el mal servicio","Muy mal servicio, demoradísimos para traer platos simples y el lugar es estrecho con poca ventilación. La comida no es la gran maravilla. Hay mejores."
"Kurenai Maid Cafe","Malo!","El día de hoy estuve comiendo en el Kurenai Maid Café de la carrera 19 con calle 114 con expectativas de encontrar un buen Ramen pero desafortunadamente no fue así. A continuación enumero el porque no volveré ni recomiendo este restaurante:

1. Y creo q...Más"
"Central Cevicheria av. 19","Cena","La comida como siempre: maravillosa.
El sitio, absolutamente despedidor, es necesario qie insonoricen, el ruido de los comensales es demasiado y a esto, hay que agregarle la musica. Entonces, si se trata de hablar....francamente imposible.
Comiencen por quitar la musica y no le pagan a...Más"
"Nazca","GUSANO VIVO EN ENSALADA","Una de las peores experiencias !!! No por el sabor de la comida, sino por el tremendo GUSANO que salió en la ensalada, estaba con clientes y fue el oso más grande!

Me preocupa que para que un GUSANO de ese tamaño salga no hubo...Más"
"La Hamburgueseria","Pésima relación calidad-precio","Solia ir a la hamburguesería, hasta que subieron sus precios, cobran las papas aparte y la ultima vez que fui pedí una hamburguesa de falafel y me dijeron que  tenia un costo adicional, pero en la carta venia incluido."
"Shamua","Actitud y servicio","Llegamos 5 amigas a comer . Solo ofrecen mesa para 4 y un asiento. Prefirieron perder cinco clientes antes  de perder dos puestos al juntar dos mesas. Definimos retirarnos a otro restaurante que nos atendió con altura. Que lastima ver lo mal que estan. Cero...Más"
"restaurante mirador la paloma","La Paloma supermalo","Lleno de sillas feas, sucias y viejas. El lugar en general es sucio y feo. Nos sentamos y después de un rato nadie vino a atendernos."
"Papaya Capital Gourmet","No (con diferencia) obtienes lo que está en el menú","Cuando llegamos, recibimos inmediatamente un menú en inglés. Los ingredientes utilizados no eran en absoluto los mismos que los mencionados en el menú. Se suponía que el taco vegetariano consistía en pimientos asados, guacamole y frijoles rojos. Lo que obtuvimos fueron tacos con tomate, ensalada...y champiñones. Cuando explicamos esto, el dueño simplemente dijo que ella no entendió y se fue. Además, las cosas que pedimos no eran de buen gusto. Te recomendamos que no vayas.Más"
"Home Burgers","PESIMAS","Cruda la carne y absolutamente grasosas. Poco sabor. A pesar de ser precios cómodos son Caras para lo malas. No las recomiendo"
"Amen Ramen","Una amarga, amarguísima experiencia","esa estrella se la doy nada mas a la atención, que fué lo único bueno. Me parece carísimo para la calidad del producto. He comido muchas clases de ramen pero este en particular estaba feo. Una sopa totalmente desequilibrada en sus sabores, asquerosamente condimentada y...Más"
"Selina Bogota La Candelaria - Restaurante","Pésima atención y comida normal para el precio...","Visité el restaurante de Selina porque se veía un lugar ameno, sin embargo, desde que llegamos nadie nos recibió, finalmente buscamos nosotros mismos una mesa, después de un tiempo esperando nadie se acercó a entregarnos la carta por lo que tuve que ir a solicitarla...Más"
"La Cerveceria","No pierdan su dinero y pasen un mal rato.","El 3 de octubre de 2021 ordene  unos nachos los cuales según el menú tenían: pico de gallo, guacamole, Chili con carne, queso y jalapeños. Decepción total era una montaña de nachos untadas de salsa de queso. Informe la inconformidad y no hicieron nada solo...cobrarme la cuenta 39.900por unos nachos de paquete en un plato. No pierdan su dinero.Más"
"Misia by Leo Espinosa Zona G","Pésimo","La comida es de muy mala calidad, los jugos y raspados no son de fruta, son artificiales bebidas y la atención pésima"
"Republik","Para no volver a ir","Hacia muchos muchos meses que no cenaba en este restaurante . Sinceramente no recordaba una comida tan mala y menos japonesa 

Se me ocurrió pedir un steak tartar de salmos , que gran error por mi parte .  Ni la presentación es buena y es...probablemente el peor steak tartar que he comido en mi vida 

No volveré a ir a este restauranteMás"
"Coctel del Mar","Nunca contestan, domicilio 3 horas después y comida fría","Me demoré 40 minutos intentando que contesten, luego es un proceso tedioso y largo para tomar el pedido, la comida llega 3 horas después y además fría. Lástima porque la comida es rica pero al llegar fría se pierde toda la calidad y el sabor....Más"
"restaurante mirador la paloma","Ridiculous prices !","El lugar puede tener un ambiente acogedor por encontrarse en una de las mejores vistas de la cuidad. Pero los precios y la atención son totalmente desastrosas.  Cuando llegamos no tenían menús disponibles y solo habían un par de mesas ocupadas. La mesera no sabia...Más"
"Juana la Loca","Es una lastima","El local y el montaje del Restaurante son muy buenos, una terraza muy bonita ; pero la Comida es muy mala. Ordenamos dos entradas que fueron muy regulares y guardamos la Esperanza para el principal... Pero fue un desastre, pasta son salmon que no decia...Más"
"Kurenai Maid Cafe","Decepción total","No tiene la magia de un maid café, aunque amables las meseras no se comparan en nada al servicio que se recibe en cualquier sitio en  AKIHABARA, no hay canto o algo extra. Esta primera vez que como tempura sin que tubiera tempura, solo 4...Más"
"Fruterias Patty","Solo nombre","En varias ocasiones realice pedido a domicilio y llegaba con el helado derretido y otras nunca llegó el pedido. Hice el reclamo y nunca respondieron. Y la tapa fue hoy que hice el pedido y me dicen que no tienen coco, qué vergüenza"
"Balsamico","Primera y última vez","El servicio al cliente es algo que en este lugar no conocen,  botan el menú al cliente, la orden nunca llegó completa, sin embargo si iban a cobrar todo, se les solicitó cambio de factura y no deseaban acceder en un inicio, preferí ir al...Más"
"Il Filetto","Pésimo de verdad","Un amigo me avisó que los restaurantes en Bogotá estaban realizando el Bogotá food week y decidimos probar con este restaurante pues tenía buenos comentarios y calificaciones. Realizamos la reservación a través de la página oficial de ese evento e igual quedo registrada en restorando....Más"
"Enchiladas La Candelaria","Decepcionante","Terrible el servicio, más de 50 minutos para servir la comida, que tampoco ameritaba tanta demora. Aunado a que la comida no tenía casi sabor. Realmente muy decepcionada. El precio desproporcionado con la calidad de la comida."
"Gigi's","TERRIBLE EXPERIENCIA","Desafortunadamente es una terrible experiencia, fui con mi familia, la comida tardo más de 45 minutos, los cuales solo llegaron 4 de 5 platos y el 5to llego 15 minutos después... en total 1 hora para un simple plato de pasta el cual parecía hecho...Más"
"Bagatelle","Pésimo servicio","La comida es regular, buenas ideas mal implementadas, el servicio es muy malo. Prácticamente nos levantaron de la mesa porque tenían que arreglar el espacio para un bautizo. Es un lugar pretencioso."
"Crepes & Waffles","Creps and waffles  world trade center","Una pesima experiencia, Al desayuno  los jugos los sirvieron en vasos sucios 2 veces,  el chocolate no es natural  es instantaneo parece chocolisto mal hecho,  la atencion demorada y a destiempo, en general muy regular..  y el precio... ni se diga,  con ese valor voy...Más"
"Bagatelle","Pésimo","El pan es una porquería.  Los huevos asquerosos. Los jugos malos. El servicio lento y desentendido.  Los precios exageradamente elevados.  No regresaría jamás."
"Tremenda Sal y Dulce","Mal servicio","La ubicación del lugar es compleja, llamas y las personas tampoco te ubican, en las aplicaciones tampoco especifican como llegar. Para que tomaran el pedido se demoraron 15 minutos y casi 40 minutos para que llevaran la comida. En pleno día de padre ni siquiera...tenían pan... llevaron los componentes por partes, terminamos desayunando a cuotas... en conclusión un servicio TREMENDAmente MALO. No vayan!!Más"
"El Bandido Bistro","El peor lugar de la historia","Éramos 4 y esperé dos horas para una mesa y nos dieron el bar y esperé dos horas para una mesa, después de 3 horas nos fuimos"
"restaurante mirador la paloma","Mal servicio, mala comida, precios elevados","Una de las peores experiencia ms gastronómicas. El servicio es lento, mala actitud. L comida es insípida y se demora un montón, los cubiertos que me dieron estaban sucios y rotos. Los precios son exagerados.
Recomiendo no ir nunca a ese lugar."
"El Corral Gourmet","Comida en malas condiciones","Fuimos almorzar al corral Gourmet del cc Santa Fe y ordenamos con mi esposo unas Hamburguesas a bistec caballo y de chipotle ... la carne estaba mal cocida y nos intoxicamos... el colmo pagar  70.000 pesos para acabar intoxicados..."
"Jungla Kumba","Pésimo servicio / comida","Buena ambientación, el servicio desordenado, la comida aceptable pero demorada y excesivamente costosa! Pedimos sushi: muy escasa selección a un precio astronómico. Fuimos con niños y el trato hacia ellos fue muy desconsiderado.Más"
