"nombre","titulo_comentario","contenido_comentario"
"La Xarcutería","Nos repitió la visita al día siguiente para probar los platos!!!","Berenjenas, Chicharrones, filet mignon, costillas, salmón y hamburguesas eran más que excelente!! Y, me olvido tienen artesanías locales que no se vendía en cualquiera de los restaurantes locales cerca de éste."
"Watakushi","El mejor japonés de Bogotá","He ido ya varias veces y siempre es excelente...buen ambiente, muy buen servicio y trato, gran variedad de platos, japoneses, asiáticos,...sale a unos 40-60.000 pesos sin vino. Para ir a menudo."
"SAN GIORGIO TRATTORIA","Excelente!","No soy amante de la comida italiana pero en este sitio está muy bien. La atención es muy buena y las porciones son generosas."
"Corchos Barcelona -Colina","Plaza claro","Excelente... la atención de don juan pitre excelente... la comida deliciosa... recomendisimo el plato pesca fresca sugerido por Don Juan"
"Leños y Carbón ","Leños Gourmet gran estacion","He ido varias veces y el servicio siempre es excelente, el restaurante es bonito y la comida deliciosa
Mi favorito es Especial leños, incluye todas las carnes: res, lomo, cerdo y pollo. 
Los precios oscilan entre 27.000 y 60.000"
"Corchos Barcelona -Colina","Excelente servicio!","Nos atendieron espectacular, Johnn Jairo es una persona supremamente servicial y dedicado. La comida muy rica y el restaurante espectacular. 

Instagram: Laucoronadoh"
"Al Agua Patos","Ingredientes convencionales, pero con mezclas innovadoras","Son ingredientes y productos muy afines con la cultura colombiana, pero en este sitio le ponen  creatividad al asunto. Me fue muy bien con el desayuno y con la experiencia de servicio. Rico y creativo."
"Viva la Vida","El mejor restaurante de comida japonesa","Iba con la idea de que sería un buen restaurante, pero me sorprendieron en la calidad, servicio y sabor. Sin duda alguna el mejor restaurante de Colombia. 
La experiencia con el sake a cargo de Cristian acero fue sin duda de las mejores que he...Más"
"Restaurante Lomos","De lo mejor","Es un restaurante tradicional con un servicio de primera y unos platos deliciosos, el lomo al trapo y el filet mignon son exquisitos al igual que las empanaditas de entrada."
"Coctel del Mar","Delicioso","Vi la carta y quería pedir todas las entradas, delicioso y el precio es muy cómodo. vale toda la pena. Recomendada la causa limeña con camarones, la paella y las conchitas. No recomiendo las muelitas, venia muy poca carne en ellas."
"El Arabe","Aniversario","Fuimos a comer y celebrar. La comida es excelente, el servicio es maravilloso, los precios adsequibles,  el tiempo de espera es justo. Hay que volver"
"Pesquera Jaramillo Parque de la 93","no puedes perder una visita a su cava privada para cenar en grupo","el menú es brillante. recomiendo el pulpo a la gallega. Para elegir vino, déjate guiar por su experto.

Me encanta que haya música en vivo todavía."
"El Cielo Bogota","Experiencia en 5 Sentidos","Más que un restaurante es una gran experiencia que involucra los sentidos, ambiente único, servicio excelente dispuesto para un adecuado de comensales.  Recomendado!!"
"Capitalino Restaurant","Cumpleaños","Excelente atención. Jainer Fernández. Gracias por toda tu atención.
Comida variada. 
Sitio amplio
Gente agradable 
Postres ricos"
"Kathmandu","Me encanto!","Un sitio precioso en su ambiente y decoración. La comida deliciosa y una oportunidad de degustar una mezcla de sabores de Asia y Medio Oriente. Me sorprendió gratamente y volveré. Muy buena atención y excelente calidad precio/valor."
"Bon Market and Bar","Buen plan de Rodizio Italiano para compartir, festejar y aprender","Deben  venir a este plan recomendado al 100% buena comida, buena música y no olviden una buena compañía para hacer aún más ameno y divertido este plan.

Un recorrido por la gastronomía italiana que vale la pena, un pedazo de Italia en Bogotá ñ, así...Más"
"Darius","Pescado frito delicioso","Fuimos un sabado. El ambiente es  agradable y la atencion muy buena. Pedimos una cazuela mixta pequeña y pargo frito. Los dos platos estaban muy buenos, pero vale la pena resaltar que el pescado frito es excelente, fresco, crocante y con la carne suave. La...Más"
"ConoSur","Mi sitio favorito de conos de sushi","Si quieren probar sushi de una forma diferente, esta es la mejor elección. He ido más de dos veces y siempre pido Filadelfia tempura, es el mejor. Amo este restaurante aunque las porciones pueden ser muy pequeñas."
"Sir Frank Hot Dog Joint","Deliciosa carta..","Muy buena comida. La hamburguesa, hot dog y mazorca muy agradables, pienso a diferencia de muchos que las prociones son buenas. No dejen de probar las malteadas y postres (perfecto para compartir)"
"Osaki 93","No se como no fui antes","Tiene una carta muy amplia, excelente servicio, ni te dejan esperando horas, el espacio es muy ameno y ni habla de los curries... Recomendado el curry massaman!"
"Maria Candelaria","¡Gran lugar!","¡La comida es increíble! A veces hay que ser paciente, porque lleva un tiempo, ¡pero merece la pena!"
"Guadalupe Latina","Comida en Familia","Sin palabras. Excelente servicio, comida deliciosa ambiente perfecto para pasar un gran rato!!!! Una navidad para el recuerdo. Ojalá top 50 muy pronto!! Un gran saludo y abrazo para los mejores meseros Isaac, Camilo y Maryorie! Súper recomendados!!!

Alejandro Machado Salinas"
"El Cielo Bogota","Excelente restaurante","La comida es realmente buena, deliciosos y creativos platos que te hacen pasar unos momentos realmente memorables. He visitado varias veces este restaurante y siempre esta a la altura de mis expectativas. Recomendable."
"Archie's","Excelente comida italiana!","Los platos en Archie's son excelentes.  Mis preferidos son entrada de Calamares y Ensalada del Chef. Espectacular.!! A mi esposa le fascina en Carpaccio y Lasagna Bolognesa."
"Tapas Macarena","Personal amable y exquisita comida","El último segundo día en Bogotá, hemos decidido tener una buena cena y nos encontramos este pequeño tesoro.
Es acogedor pero la música y el ambiente son los dos geniales. La comida es absolutamente preciosa (pero el precio es más que la media).
Si tienes...un presupuesto y quieres tener una buena cena relajante, esta será una gran opción para usted.Más"
"Tet Taberna Vietnamita","Fresco nuevo lugar, muy buen gusto! Buenos precios..","No han sido muchos restaurantes del Sudeste Asiático en Bogotá. . . ""Por lo que recuerdo"". . . Pero hoy, el azar fue invitado a salir a cenar y encontramos este nuevo lugar vietnamita gran y acogedor.
Es en el área de cultivo de Quinta...Camacho, cerca de la zona G, pero con precios no muy caros. Puede ser con 15 USD por persona podrá disfrutar de una comida deliciosa y generosa super vietnamita.
Tuve la oportunidad de visitar Vietnam este año y el sabor es muy como. Tuve una buena sopa de pollo pho, mis amigos tenían cerdo frito, calamares arroz y rollitos de primavera, todos super sabrosa y similar a la comida vietnamita local.Más"
"Tapas Macarena","Espectacular!","Una opción increíble en la zona de la Macarena. Enorme variedad de tapas, excelente calidad de productos, atención de primera. El local es pequeño y el volumen de la música permite que se pueda disfrutar de una buena charla. No vi televisores (punto a favor!!!)....Más"
"El Mono Bandido","Amigos!","Muy buena opción para compartir en compañía de amigos o pareja , deli la cerveza y execelente servicio"
"Tanoshii Asian Cuisine & Lounge Bar","Excelente servicio.","Excelente lugar. Quede encantada con la comida. Siempre que puedo vuelvo y pido un rollo Dragón, el mejor de Bogotá. Excelente atención la de Camila, muy pendiente del cliente. Recomendado!"
"Las Cuatro Estaciones","Sorpresa","Se nota que hay nueva mano en cocina, porque han mejorado mucho los tiempos, las cocciones y las presentaciones. Hay una carta española con una mirada actual y una carta de vinos que, aunque mejorable, ofrece buenas referencias. 
El chuletón, las vieiras y la entraña...Más"
"Inkanto Peruvian Cuisine C.C Multiplaza","Cumpleaños","En mi visita al restaurante Gran inka ubicado en el Cc  multiplaza, la pasé genial, el servicio expectacular al igual que la comida, me sentí muy bien atendida, con gusto lo recomendaría y volveré con total agrado."
"Tramonti","Un lugar muy especial","La comida deliciosa, la atención super, ideal para fechas muy especiales o para ser romanticón. :) :)"
"Pajares Salinas","Sigue siendo el # 1 de Bogotá","El el mejor restaurante,aunque no tiene música (que maravilla ), todos los platos son muy bien hechos y de gran calidad"
"Nueve","Muy buen sitio","Es un sitio muy bueno para compartir unas tapas originales (basadas en cocina colombiana) y buenos vinos. Andrei, el sommelier, es muy atento y conocer. No venden platos fuertes grandes ni botellas de vino en temas (no de entrada por lo menos) pues el objetivo...Más"
"Mediterránea de Andrei","Espectacular!","Deliciosa la comida, excelente decoración y ambiente. Inmejorable atención! Vale la pena sobre todo porque es costoso, pero lo vale totalmente!"
"Santa Fe Cafe & Restaurante","Comida colombiana ESPECTACULAR!","Fuimos con mi esposa, nos atendieron muy pero muy bien, con mucho respeto y nos dieron excelentes recomendaciones. Yo pedí una sopa, un mute santandereano, con hormigas culonas!!!! y mi esposa pidió una corvina. Los sabores increíbles! Todo 10 puntos, para volver sin pensarlo.Más"
"Piazza Italia By Storia D'amore Calle 93","Excelente rato con amigos 👌","Deliciosa la comida, los postres y los cócteles. Milhojas de frutos rojos 100 puntos. Hermosa decoración. Muchas Gracias por la excelente atención José."
"Vitto","Buenísimo!","Muy buen restaurante, no tienen una carta amplia pero lo que ofrecen es delicioso, no es barato pero vale la pena, el servicio es muy bueno."
"Mi Gran Parrilla Boyacense","Gran atención y comida deliciosa","Un lugar lujoso, muy buena atención y presentación de los meseros, la comida deliciosa los platos bien elaborados y pircuobes grandes, muy recomendado"
"Quinua y Amaranto","Rico y recomendable","Un lugar agradable para hacer un alto en la visita a la ciudad y comer sano y muy rico.
Lindo ambiente y personal muy amable. 
Detalles de buen gusto en la decoración."
"Restaurante La Estancia Chica","Increíble!","Sin duda alguna, esta es la mejor parrilla argentina de todo Bogotá. Es extremadamente delicioso en todos los corte argentinos y nacionales y su variedad de vinos y acompañantes es excelente."
"Sumo Sushi","Excelente comida, los sushis","Excelente comida, los sushis son deliciosos y el servicio excelente, atención rápida, recomendadísimo
El ambiente y música muy buena"
"Jeno's Pizza","EN CENTRO CHÍA, MUY BUEN SERVICIO, PIZZA DELICIOSA","Las personas que atienden son muy amables.  La pizza delgada de vegetales es muy buena.  Además, vimos el partido México-Uruguay muy cómodamente porque Jeno's es uno de los pocos restaurantes de Centro Chía con local propio en la zona de comidas, con TV propio también."
"Circo Terraza Zona G","Cena","Gracias a todo el equipo de circo, especialmente a stefany y Leonardo por su atención, siempre nos hacen sentir como en casa ! 

Gracias chicosMás"
"Bistronomy by Rausch","Exelente opción","Buen sitio, uno de los pocos lugares en Bogotá que no lo detienen al entrar por la hora 
Excelente comida y servicio 
Buena selección de vinos"
"Brera Restaurante","Cena con amigos","Es un lugar muy bien ubicado, diferente, acogedor y con excelente servicio. La comida deliciosa. Las porciones son adecuadas y muy bien presentadas."
"Tanoshii Asian Cuisine & Lounge Bar","Gran personal, excelente comida y bebida ...","Sushi en Bogotá no es lo que normalmente se considera, lo que me dieron fue excelente! Carlos y sus colaboradores fue muy atento y eficiente incluso durante la Colombia muy concurrida V. partido de fútbol de Brasil. La sopa de miso fácilmente fue el mejor...que he probado ... sabrosa sin ser abundante y un precio muy razonable. La selección de la comida era excelente y tenía un poco algo para todo el mundo. Disfruté del té/Sake cócteles. El ambiente es moderno y acogedor y fácil de mantener una conversación y aún así mantener el partido en cualquiera de la televisión's. Un hurra para el personal.Más"
"La Fama Barbecue","Siempre es buena idea","Vivo en bogota y me encanta visitarlos, el servicio es excelente , el ambiente es muy acogedor y siempre la comida es buena . Recomiendo las papas criollas con salsa y chimichurri , no recomiendo el sandwich  de pastrami."
"Taj Mahal Indian Restaurant","comida increíble súper ambiente","Si estás buscando toque picante indio que estás en el lugar correcto. impresionante y deliciosa comida y muy buen servicio. chef duras Bhatia prepara comida como por su sabor picante de tamaño, picante menos, picante o no picante. No te lo pierdas makkini Dal no...encontrará el sabor incluso en la India también.Más"
"Bicono","INCREIBLE","Las hamburguesas son ESPECTACULARES! muy jugosas y en el punto perfecto. Los sabores se mezclan de una forma única y no le hace falta absolutamente nada. 
La mazorcada con panceta también es una cosa loca."
"Restaurante La Jugueteria Cedritos","Celebración de cumple","Excelente experiencia Gracias por todo, volveremos, el restaurant muy bonito, La atencion de Jorge super Gracias por todo.."
"WOK","Delicioso, con gran sentido social y ecológico.","La comida es muy muy buena, probamos varios platos y todos nos gustaron, el menú es muy variado, la atención muy buena, pero lo que más me gusta es su sentido social y ecológico, eso creo que es muy valioso. Recomendados: bomba maki, salmon wok,...Más"
"Calzone di Roma","Excelente atención","Vinimos en familia, buena comida, ambiente acogedor, pasamos un sábado agradable. Recomiendo la salsa de tres quesos."
"La Diva Pizzería","El perfecto ambiente para comer la mejor pizza.","Cuando estaba en la entrada del restaurante no me esperaba mucho pero al entrar quedé deslumbrada. El restaurante es uno a los pequeños restaurante a que he visto. El ambiente es espectacular mente romántico. 
Definitivamente recomendado para una cita.
Los meseresos son muy agradables y...Más"
"Bagatelle","El desayuno era excelente, con abundantes opciones de huevo","Como en el restaurante Chia esta Bagatelle es también una excelente opción para un abundante desayuno con una amplia selección de huevos. Desde las versiones colombianas locales con arepa frito y sobre los huevos benedictinos. Como bien gofres, tortitas y fresco zumo de frutas (prueba...el Strawberry banana/ ! ).  Muy recomendable, aunque no tan niños como la Chia.Más"
"Tierra Restaurante","Excelente Comida","Platos deliciosos, muy buena relación calidad precio. Súper recomendado el pulo. El servicio muy bueno."
"Cafe Amarti","Una comida Exquisita!!!","Un lugar muy tranquilo, adecuado tanto para familias, como para parejas, como para grupos de trabajo, reúne una decoración bien pensada y una comida exquisita, los precios son acorde a los platos."
"La Biferia Usaquen","La mejor carne no solo en Usaquen, si no en todo Bogotá","me gusta tener el mejor restaurante según el tipo de comida, y sin lugar a dudas en la categoría: carne de res: este es de lejos el mejor restaurante de todos."
"Inkanto Peruvian Cuisine C.C Multiplaza","Celebración cumpleaños","Nos pareció un excelente restaurante con una comida muy deliciosa, Excelente servicio cuenta con música en vivo. 
Sin duda lo recomiendo"
"Bistecca e Vino Da Trattoria de la Plaza","Muy rico","La atención de Mateo excelente. Muy buena selección de vinos y comida rica. El
pulpo un poco salado. Volveremos!!!Más"
"El Portico","El mejor en Bogota, Trae tu Camara!","Esta hacienda es el más maravilloso entorno para una reunión familiar o simplemente un sentimiento comida con amigos.

Una decoración espléndida de antiguos años de Bogotá ido adiós. Grandes recuerdos aquí! Precioso patio pequeño bebiendo vino ... situado en el norte,
amablemente Visita su página...web para información adicionalMás"
"Cacio & Pepe Taverna Italiana","Excelente lugar y mejor su comida y sus vinos","Un sitio agradable para comenzar una cena con un buen vino, su carta aunque no es muy extensa tiene buenos platos; en postres están un poco cortos.
Gran variedad en cocteles, vinos y licores."
"Restaurante Yanuba","Exquisito !!!","Un lugar tradicional con comida deliciosa !!! Recomendadisimas las tortas !!!! Permite reservas . El costo de los platos y la proporcion es perfecta !!"
"La Ventana restaurante","Excelente servico","Estuvimos celebrando el cumpleaños de mi hija de 5 años donde había entretenimiento para toda la familia y para ella un cuarto de juegos, aparte la buena comida y su gran variedad recomendado para q ir con la familiaMás"
"Ceviche Fusión","Mi restaurante favorito. Por calidad y economia.","La atencion y servicio es suprema. Los platos son economicos para su extraordinaria calidad.
Encuentre los mejores platos de comida peruana."
"Leo","Excelente siempre","Muy buenos platos en general, diversidad de proteinas y opciones vegetarianas. Buenas bebidas y servicio"
"Beirut","Comida árabe en pleno Bogota","Comida árabe en pleno Bogota, gran Resto de comida arabe. ME sentí como en casa. ambiente familiar. Shish Kebab una delicia y los Khadafi exquisitos. Volveré!"
"El Portico","Mágico!!!","Es un lugar muy especial para estar en familia y para eventos. 
Es una mezcla entre un gran ambiente y excelente comida típica bogotana, la espectacular carne a la Fragua y las mejores empanadas del mundo. 
Un lugar mágico y especial..romántico!!"
"Ugly American Bar & Grill","La comida es alucinante!","Hemos estado aquí dos veces y las dos veces el servicio, la comida y el ambiente era genial. Las hamburguesas son excelentes! También disfrutamos del aperitivo alcachofa. Gran experiencia, ¡volveremos!"
"Isola - Trattoria Bar","Me encanto","Buen servicio y buena comida, nos atendieron muy bien pedimos comida y cocteles y todo estuvo super bien"
"Sumo Sushi","Me gustó mucho","Yo tenía nada más salir de un lugar cercano debido al servicio horrible. Así que para encontrar el sumo y su fantástico servicio era genial.

La comida está muy bien; no me hinchable. Pero estaba bien, y disfruté de mi comida. Pero este lugar recibe...5 estrellas porque el servicio fue tan maravilloso, lo que a veces puede ser difícil de encontrar en Colombia. Y, es un lugar muy relajante y acogedor. Sólo hay 6 mesas pequeñas. Es un gran lugar para tomar una fecha, que espero hacer mañana (si ella dice que sí).

Mi pedido de edamame era bastante pequeña, pero estaba muy barato, así que estaba bien. Y nunca he tenido frío sake, pero estoy seguro de que volveré a calentar, si lo pides.Más"
"La Chorizeria","Me encanta","Muy informal, deliciosos chorizos y hamburguesas, buenas cervezas heladas y rock a todo volumen. La atención es rápida y amable. Perfecto para ir un viernes o un sábado."
"SPQR","Buen brunch","Comida deliciosa, buen servicio en atención y tiempo de preparación. Son amables y atentos a los requerimientos de los comensales."
"Bellini","Bueno","Muy buena la comida, atentos, buen servicio a la mesa. El restaurante muy agradable, el personal muy pendiente del cliente. Vale la pena, volvería sin duda"
"Tet Taberna Vietnamita","Comida deliciosa en un lugar no descubierto por muchos","Tet fue una verdadera sorpresa. Al principio, guiados por comentarios que estaban en Tripadvisor, estabamos bastante prevenidos y con intención de abandonar el restaurante ante el primer inconveniente. Pero, tanto las entradas como los platos fuertes fueron de maravilla, con raciones generosas y un sabor...exquisito. La calidad es más alta que otros restaurantes de comida asiática, con mayor renombre en Bogotá como Rokko o Ko. Sin lugar a dudas, deben animarse a conocer este lugar porque llenará bastante sus expectativas. Tampoco se desanimen por los comentarios sobre los precios, ellos están dentro del promedio de la gastronomía colombiana .La calificación de 5 puntos que le doy se debe a la necesidad de incentivar estas joyas escondidas en Bogotá, pero el único lunar del restaurante consiste en que requiere una mejor atención a las mesas, ya que el servicio no estaba pendiente de las necesidades de los comensales. Si mejoran este detalle, todo les saldrá a la perfección.Más"
"Flambée Bistró & Café","Gran Restaurante de casual food","El menu del día es muy bueno y el creme brulee de lo mejor, hace la diferencia en la zona, tiene buena energia"
"Storia D'amore - Zona T","Excelso","El lugar muy bello. La atención espectacular. Desde Leidy en la puerta. Jhon Moreno y sus atenciones. Williams y su pasta y Simone el gran artista. Que experiencia tan agradable. Realmente Excelso!!!!"
"Tramonti","Día de la mujer","El servicio excelente, y los platos deliciosos muy bien ubicado con excelente vista a la ciudad, muy buen lugar para celebrar fechas importantes"
"La Bruja","Ambiente romántico","Estuve allí celebrando un cumpleaños y fue maravilloso, me encanta la comida, tiene luz ténue y es encantador. No pude evitar pensar que es un lugar para ir en pareja a compartir."
"Salvo Patria","Un rato inolvidable","La atención y la comida son muy buenas salvo patria es un lugar donde comer es algo realmente agradable y la verdad no se van arrepentir de pedir el corte de cordero de temporada, la carne es tan suave que sólo tocándola se desprende del...Más"
"Bicono","Almuerzo","Todo excelente, la panzeta en su punto, el pulpo mejor imposible, el ceviche muy buen sabor y sin mencionar e tartar una delicia. La hamburguesa descomunal."
"Coctel del Mar","Excelente comida de mar","La comida excelente, el servicio inigualable. El almacén anexo tiene mucha variedad de productos y de muy buena calidad."
"La Romana: Av. Jiménez","Excelente Lugar , Café y Atención","Como todos sabemos Colombia es considerado el mejor País cafetero, y así es, a donde quiera que vayas encontrarás un sinfin de restaurantes. El café de este lugar es realmente rico y los precios son accesible, también tiene gran variedad de postres típicos, te recomienda...Más"
"Capital Cocina y Café","Entorno increíble, impresionante comida y un gran servicio.","Tuvimos una maravillosa comida de la noche aquí estar arriba.

El personal es estupendo, muy atentos y dispuestos a hacer recomendaciones. La comida era deliciosa y un verdadero cambio de la sofocante comida frita colombianas típica. Una de las mejores comidas que tuvimos en 17...días en Colombia.

Una gran selección de cervezas que me mantuvo entretenido y pusimos contentillosMás"
"Gamberro","Buen servicio, comida deliciosa y buen ambiente","Un lugar delicioso

Fui a celebrar mi cumple y fue una muy buena experiencia 

El servicio fue muy bueno y los meseros están muy pendientes de que estes feliz y disfrutes tu estadía en el lugar 

La comida deliciosa con un termo o excelente en...temas de carne y en un buen tiempo de espera.

Ticos de salmón: Un must
Costillas de cordero: Rico pero pide 4 und 
Lomo sellado: perfecto el termino 

Postre de cumple;  perfecto ;)

El lugar es lindo adentro, la parte de afuera se siente como plazoleta de comidas de mall.Más"
"Luna","Simplemente delicioso...","Uno de mis restaurantes favoritos. Buen ambiente, buen servicio y comida maravillosa.  Para mi, perfecto. Muuuuy recomendado"
"Storia D'amore - Zona T","Cena con amiga","Esta noche vinimos a conocer storia d’amore con mi amiga y fue increíble, la comida es deliciosa, pero la atención fue excelente, John Pescador y Oscar Leaño fueron muy amables, muchas gracias por esta experiencia."
"NN Food Hall","Cena buenísima acompañada de piano de cola","La comida es excepcional, pedí filete Wellington y estaba buenísimo y al punto. 
Destacaría la presencia del pianista-cantante con el que hubo una gran conexión y tocaba las canciones que uno le  solicitaba.
Personal y metre muy amables, como es habitual en Colombia.
Muy aconsejable...Más"
"Cafe & Crepes - El Cafe del Alpinista","Ambiente encantador y comida deliciosa!","El lugar desde la entrada al final es espectacular,es acogedor y tiene muchos ambientes, como terraza, espacios para parejas y grupos grandes. La comida es muy rica, claro etsa hay que probar sus especialidades en cafè y crepes. La decoración es una maravilla, muchos detalles...Más"
"Viva la Vida","Cena romántica","Excelente todo. Fui atendido por Cristian Acero y Tatiana. 10/10
Pedimos pulpo
Costillas de cerdo
Sushi épico 
Bonsai de postre"
"Madison","Hamburguesas superespeciales","Las mejores hamburguesas de Bogota. Sabores variados en su punto. ""La Alejandra"" deliciosa, pero para disfrutar todas excelente pedir las mini . También hay  otras opciones igualmente ricas como las costillitas de cerdo y  de entrada los  jalapeños popper. En fin un lugar chevere para...Más"
"Arigato","Nunca falla","La mejor y más auténtica comida japonesa. Solo hay que ver a japoneses comiendo allí. El trato es excelente. Los domicilios se realizan sin problema. Soy cliente habitual y nunca me han fallado. Enhorabuena!!!"
"Sandwich taller","magnifico","excelente servio, cada sándwich que he probado a sido una experiencia de otro universo ( la conexión con los sabores y las energías hacia el plato es algo Magnifico."
"Restaurante la Puerta de la Catedral","muy buen restaurante","este es un muy buen restaurante del centro de Bogota. Muy rica comida, abundante, bien presentada y precio medio."
"MERCARI Calle 90","De primer nivel","Mercari es una pastelería y panadería deliciosa, para desayunar o para un almuerzo ligero. Todo es de buen gusto. Recomiendo sin dudarlo los huevos fritos con salsa de queso. Los brownies de Milo son deliciosos, así como la torta de pan. Es un sitio para...Más"
